{
  "project": {
    "name": "Loom",
    "context": "A flexible system that automates the software development lifecycle - from initial research discussions through to deployed code - where developers can use ANY AI model or tool at ANY stage of the process.",
    "tech_stack": "Python, markdown",
    "architecture": "Open orchestration",
    "target_users": "Developers",
    "constraints": "Model API Differences, Context Management, Output Consistency, Error Handling & Reliability, State Management, Security & Privacy, Cost Predictability, Performance Optimization, Human-in-the-Loop Challenges, Project Understanding"
  },
  "github": {
    "repo_owner": "StephenDMay",
    "repo_name": "Loom",
    "default_project": "Loom-Board",
    "default_labels": [
      "auto-generated",
      "needs-review"
    ]
  },
  "llm_settings": {
    "default_provider": "gemini",
    "output_format": "structured",
    "research_depth": "standard",
    "temperature": 0.6
  },
  "templates": {
    "directories": []
  },
  "automation": {
    "auto_create_issues": true,
    "auto_assign": true
  },
  "agent_execution_order": [
    "issue_generator"
  ]
}